{
  "schema_version": "1.0.0",
  "domain": "Math",
  "chapter": "Arithmetic-Progression",
  "skill_id": "math.number_system.lcm_hcf",
  "language": "hi",
  "provenance": {
    "source": "Math Source Evidence",
    "chapter": "Arithmetic-Progression",
    "evidence_hash": "0000000000000000000000000000000000000000000000000000000000000000"
  },
  "questions": [
    {
      "id": "math-q-001",
      "source_question_id": "sqi.math.arithmetic-progression.PYQ_AP_01",
      "pattern_id": "PAT_AP_01",
      "provenance": {
        "origin": "authentic_pyq",
        "source": "SSC CGL 2023"
      },
      "question_type": "mcq",
      "difficulty": 2,
      "question": "Which term of the arithmetic progression 21, 18, 15, ... is -81?",
      "options": [
        "34th",
        "35th",
        "36th",
        "33rd"
      ],
      "correct_option": "35th",
      "correct_answer": "35th",
      "recognition_signals": [
        "Linear relationship between term value and integer index n in an AP"
      ],
      "expected_method": "Apply a_n = a + (n-1)d, isolate unknown variable, verify integer validity of index n",
      "decision_points": [
        "Compute common difference d = a_2 - a_1 noting sign",
        "Formulate linear equation in index n",
        "Assert n is a positive integer"
      ],
      "trap": "Off-by-one error using n instead of (n - 1)",
      "error_category": [
        "ERR_OFF_BY_ONE",
        "ERR_NEGATIVE_DIFFERENCE",
        "ERR_ARITHMETIC"
      ],
      "hints": {
        "tier1_conceptual": "संकल्पना एवं सिद्धांत: Nth Term Forward Calculation & Index Solving के अंतर्गत Linear relationship between term value and integer index n in an AP का स्मरण करें।",
        "tier2_strategic": "विधि एवं रणनीति: समस्या के समाधान हेतु Apply a_n = a + (n-1)d, isolate unknown variable, verify integer validity of index n का अनुप्रयोग करें।",
        "tier3_next_step": "सेटअप एवं संक्रिया: अज्ञात राशि के लिए समीकरण स्थापित करें और मान प्रतिस्थापित कर गणना पूर्ण करें।",
        "tier1_approach": "संकल्पना एवं सिद्धांत: Nth Term Forward Calculation & Index Solving के अंतर्गत Linear relationship between term value and integer index n in an AP का स्मरण करें।",
        "tier2_formula": "विधि एवं रणनीति: समस्या के समाधान हेतु Apply a_n = a + (n-1)d, isolate unknown variable, verify integer validity of index n का अनुप्रयोग करें।",
        "tier3_setup": "सेटअप एवं संक्रिया: अज्ञात राशि के लिए समीकरण स्थापित करें और मान प्रतिस्थापित कर गणना पूर्ण करें।"
      },
      "solution": "चरणबद्ध समाधान:\n1. First term a = 21, common difference d = 18 - 21 = -3.\n2. Target term a_n = -81.\n3. General formula: a_n = a + (n - 1)d.\n4. Substitute values: 21 + (n - 1)(-3) = -81.\n5. -3(n - 1) = -81 - 21 = -102.\n6. n - 1 = -102 / -3 = 34 => n = 35.\n7. Therefore, the 35th term is -81.",
      "verification": "उत्तर की पुष्टि: गणना मान 35th को मूल प्रतिबंधों में प्रतिस्थापित करने पर संबंध संतुष्ट होता है।",
      "prerequisites": [
        "math.algebra.arithmetic_progression.basics",
        "math.linear_equations"
      ]
    },
    {
      "id": "math-q-002",
      "source_question_id": "sqi.math.arithmetic-progression.PYQ_AP_02",
      "pattern_id": "PAT_AP_01",
      "provenance": {
        "origin": "authentic_pyq",
        "source": "CBSE Board 2022"
      },
      "question_type": "mcq",
      "difficulty": 1.5,
      "question": "The 11th term of the arithmetic progression -3, -1/2, 2, ... is:",
      "options": [
        "28",
        "22",
        "-38",
        "-46.5"
      ],
      "correct_option": "22",
      "correct_answer": "22",
      "recognition_signals": [
        "Linear relationship between term value and integer index n in an AP"
      ],
      "expected_method": "Apply a_n = a + (n-1)d, isolate unknown variable, verify integer validity of index n",
      "decision_points": [
        "Compute common difference d = a_2 - a_1 noting sign",
        "Formulate linear equation in index n",
        "Assert n is a positive integer"
      ],
      "trap": "Off-by-one error using n instead of (n - 1)",
      "error_category": [
        "ERR_OFF_BY_ONE",
        "ERR_NEGATIVE_DIFFERENCE",
        "ERR_ARITHMETIC"
      ],
      "hints": {
        "tier1_conceptual": "संकल्पना एवं सिद्धांत: Nth Term Forward Calculation & Index Solving के अंतर्गत Linear relationship between term value and integer index n in an AP का स्मरण करें।",
        "tier2_strategic": "विधि एवं रणनीति: समस्या के समाधान हेतु Apply a_n = a + (n-1)d, isolate unknown variable, verify integer validity of index n का अनुप्रयोग करें।",
        "tier3_next_step": "सेटअप एवं संक्रिया: अज्ञात राशि के लिए समीकरण स्थापित करें और मान प्रतिस्थापित कर गणना पूर्ण करें।",
        "tier1_approach": "संकल्पना एवं सिद्धांत: Nth Term Forward Calculation & Index Solving के अंतर्गत Linear relationship between term value and integer index n in an AP का स्मरण करें।",
        "tier2_formula": "विधि एवं रणनीति: समस्या के समाधान हेतु Apply a_n = a + (n-1)d, isolate unknown variable, verify integer validity of index n का अनुप्रयोग करें।",
        "tier3_setup": "सेटअप एवं संक्रिया: अज्ञात राशि के लिए समीकरण स्थापित करें और मान प्रतिस्थापित कर गणना पूर्ण करें।"
      },
      "solution": "चरणबद्ध समाधान:\n1. First term a = -3, second term a_2 = -1/2.\n2. Common difference d = a_2 - a_1 = -1/2 - (-3) = -1/2 + 3 = 5/2 = 2.5.\n3. To find the 11th term: a_11 = a + (11 - 1)d = a + 10d.\n4. Substitute values: a_11 = -3 + 10 * (5/2) = -3 + 25 = 22.",
      "verification": "उत्तर की पुष्टि: गणना मान 22 को मूल प्रतिबंधों में प्रतिस्थापित करने पर संबंध संतुष्ट होता है।",
      "prerequisites": [
        "math.algebra.arithmetic_progression.basics",
        "math.fractions"
      ]
    },
    {
      "id": "math-q-003",
      "source_question_id": "sqi.math.arithmetic-progression.PYQ_AP_03",
      "pattern_id": "PAT_AP_01",
      "provenance": {
        "origin": "authentic_pyq",
        "source": "CBSE Board 2020"
      },
      "question_type": "mcq",
      "difficulty": 2,
      "question": "Check whether -150 is a term of the AP: 11, 8, 5, 2, ...",
      "options": [
        "Yes, it is the 54th term",
        "Yes, it is the 55th term",
        "No, because n is not a natural number",
        "No, because the sequence does not contain negative numbers"
      ],
      "correct_option": "No, because n is not a natural number",
      "correct_answer": "No, because n is not a natural number",
      "recognition_signals": [
        "Linear relationship between term value and integer index n in an AP"
      ],
      "expected_method": "Apply a_n = a + (n-1)d, isolate unknown variable, verify integer validity of index n",
      "decision_points": [
        "Compute common difference d = a_2 - a_1 noting sign",
        "Formulate linear equation in index n",
        "Assert n is a positive integer"
      ],
      "trap": "Off-by-one error using n instead of (n - 1)",
      "error_category": [
        "ERR_OFF_BY_ONE",
        "ERR_NEGATIVE_DIFFERENCE",
        "ERR_ARITHMETIC"
      ],
      "hints": {
        "tier1_conceptual": "संकल्पना एवं सिद्धांत: Nth Term Forward Calculation & Index Solving के अंतर्गत Linear relationship between term value and integer index n in an AP का स्मरण करें।",
        "tier2_strategic": "विधि एवं रणनीति: समस्या के समाधान हेतु Apply a_n = a + (n-1)d, isolate unknown variable, verify integer validity of index n का अनुप्रयोग करें।",
        "tier3_next_step": "सेटअप एवं संक्रिया: अज्ञात राशि के लिए समीकरण स्थापित करें और मान प्रतिस्थापित कर गणना पूर्ण करें।",
        "tier1_approach": "संकल्पना एवं सिद्धांत: Nth Term Forward Calculation & Index Solving के अंतर्गत Linear relationship between term value and integer index n in an AP का स्मरण करें।",
        "tier2_formula": "विधि एवं रणनीति: समस्या के समाधान हेतु Apply a_n = a + (n-1)d, isolate unknown variable, verify integer validity of index n का अनुप्रयोग करें।",
        "tier3_setup": "सेटअप एवं संक्रिया: अज्ञात राशि के लिए समीकरण स्थापित करें और मान प्रतिस्थापित कर गणना पूर्ण करें।"
      },
      "solution": "चरणबद्ध समाधान:\n1. First term a = 11, common difference d = 8 - 11 = -3.\n2. Assume -150 is the nth term: a_n = a + (n - 1)d = -150.\n3. 11 + (n - 1)(-3) = -150 => -3(n - 1) = -161.\n4. n - 1 = 161/3 => n = 161/3 + 1 = 164/3 = 54.67.\n5. Since the term index n must be a positive integer (natural number), -150 cannot be a term of this AP.",
      "verification": "उत्तर की पुष्टि: गणना मान No, because n is not a natural number को मूल प्रतिबंधों में प्रतिस्थापित करने पर संबंध संतुष्ट होता है।",
      "prerequisites": [
        "math.algebra.arithmetic_progression.basics",
        "math.number_theory.integers"
      ]
    },
    {
      "id": "math-q-004",
      "source_question_id": "sqi.math.arithmetic-progression.PYQ_AP_04",
      "pattern_id": "PAT_AP_02",
      "provenance": {
        "origin": "authentic_pyq",
        "source": "SSC CGL 2022 Tier 2"
      },
      "question_type": "mcq",
      "difficulty": 2.5,
      "question": "Which term of the progression 20, 19(1/4), 18(1/2), 17(3/4), ... is the first negative term?",
      "options": [
        "27th term",
        "28th term",
        "29th term",
        "26th term"
      ],
      "correct_option": "28th term",
      "correct_answer": "28th term",
      "recognition_signals": [
        "Positional calculation from the terminal end or finding the first negative/positive term boundary"
      ],
      "expected_method": "Use a'_m = l - (m-1)d or set inequality a_n < 0 to solve for minimal integer index n",
      "decision_points": [
        "Distinguish counting from beginning versus counting from terminal end",
        "Solve inequality a + (n-1)d < 0 and round up to next integer for index"
      ],
      "trap": "Inverting inequality sign incorrectly when dividing by negative common difference",
      "error_category": [
        "ERR_INEQUALITY_INVERSION",
        "ERR_END_TERM_REFERENCE",
        "ERR_INTEGER_CEILING"
      ],